{
  "schema_version": "1.0.0",
  "queue_name": "temp_wallpaper_candidates",
  "queue_type": "wallpaper",
  "max_candidates": 10,
  "records": [
    {
      "candidate_id": "fictional-wallpaper-001",
      "candidate_type": "wallpaper",
      "queue_name": "temp_wallpaper_candidates",
      "queue_position": 1,
      "queue_added_at": "2026-06-28T12:00:00Z",
      "queue_expires_at": "",
      "review_status": "unreviewed",
      "review_decision": "none",
      "source_name": "Fictional Wallpaper Gallery",
      "source_url": "https://example.invalid/fictional-wallpaper-source",
      "candidate_url": "https://example.invalid/fictional-wallpaper",
      "title": "Fictional Mountain Dawn Wallpaper",
      "content_rating": "safe",
      "nsfw_flag": false,
      "local_temp_path": "~/Pictures/Wallpaper Curator/Temp Wallpaper Candidates/fictional-wallpaper-001",
      "processed_output_path": "",
      "notes": "Fictional wallpaper queue record for dry-run validation only."
    },
    {
      "candidate_id": "fictional-both-001",
      "candidate_type": "both",
      "queue_name": "temp_wallpaper_candidates",
      "queue_position": 2,
      "queue_added_at": "2026-06-28T12:10:00Z",
      "queue_expires_at": "",
      "review_status": "needs_more_info",
      "review_decision": "needs_more_info",
      "source_name": "Fictional Dual-Purpose Gallery",
      "source_url": "https://example.invalid/fictional-dual-source",
      "candidate_url": "https://example.invalid/fictional-dual-candidate",
      "title": "Fictional Abstract Gradient",
      "content_rating": "safe",
      "nsfw_flag": false,
      "local_temp_path": "~/Pictures/Wallpaper Curator/Temp Wallpaper Candidates/fictional-both-001",
      "processed_output_path": "",
      "notes": "Fictional dual-purpose queue record for dry-run validation only."
    },
    {
      "candidate_id": "fictional-wallpaper-approved-001",
      "candidate_type": "wallpaper",
      "queue_name": "temp_wallpaper_candidates",
      "queue_position": 3,
      "queue_added_at": "2026-06-28T13:00:00Z",
      "queue_expires_at": "",
      "review_status": "approved",
      "review_decision": "approve_for_processing",
      "source_name": "Fictional Wallpaper Gallery",
      "source_url": "https://example.invalid/fictional-approved-source",
      "candidate_url": "https://example.invalid/fictional-approved-wallpaper",
      "title": "Fictional Sunset Horizon Wallpaper",
      "content_rating": "safe",
      "nsfw_flag": false,
      "local_temp_path": "~/Pictures/Wallpaper Curator/Temp Wallpaper Candidates/fictional-wallpaper-approved-001",
      "processed_output_path": "",
      "notes": "Fictional approved wallpaper queue record for dry-run validation only."
    }
  ],
  "created_at": "2026-06-28T12:00:00Z",
  "updated_at": "2026-06-28T13:00:00Z",
  "notes": "Fictional sample queue file for local dry-run validation only. Not a live queue."
}
